{
  "package_id": "research-integrity",
  "package_type": "skill-pack",
  "repo": "autoresearch-lab/skills-market",
  "channel": "dev",
  "version": "0.1.0",
  "summary": "Pre-approval AI failure-mode checklist (M1-M7) for research agents. Generic across domains; runs before A1-A5 approval gates, before folding results into durable artifacts, and before handoff.",
  "platforms": [
    "claude_code",
    "codex",
    "opencode"
  ],
  "source_path": "~/.codex/skills/research-integrity/SKILL.md",
  "install": {
    "claude_code": "Packaged install copies this skill into the target Claude Code skills root. Installed copies do not auto-follow repo updates; reinstall or rerun install with --force to refresh. For live repo-tracking development installs, use packages/skills-market/scripts/install_symlink_claude_code.sh against the monorepo skills root; that helper symlinks all market-listed skill-pack entries into the target Claude Code skills root, not only research-integrity.",
    "codex": "Packaged install copies this skill into the target Codex skills root. Installed copies do not auto-follow repo updates; reinstall or rerun install with --force to refresh. For live repo-tracking development installs, use packages/skills-market/scripts/install_symlink_codex.sh against the monorepo skills root; that helper symlinks all market-listed skill-pack entries into the target Codex skills root, not only research-integrity.",
    "opencode": "Packaged install copies this skill into the target OpenCode skills root. Installed copies do not auto-follow repo updates; reinstall or rerun install with --force to refresh. For live repo-tracking development installs, use packages/skills-market/scripts/install_symlink_opencode.sh against the monorepo skills root; that helper symlinks all market-listed skill-pack entries into the target OpenCode skills root, not only research-integrity."
  },
  "source": {
    "repo": "autoresearch-lab/skills",
    "ref": "main",
    "subpath": "skills/research-integrity",
    "include": [
      "SKILL.md"
    ],
    "exclude": [
      "**/tests/**",
      "**/test/**",
      "**/tmp/**",
      "**/.pytest_cache/**",
      "**/__pycache__/**",
      "**/*.pyc",
      "**/.DS_Store"
    ]
  }
}
