{
  "package_id": "literature-workflows",
  "package_type": "workflow-pack",
  "repo": "autoresearch-lab/autoresearch-lab",
  "channel": "dev",
  "version": "0.1.0",
  "summary": "Checked-in literature workflow authority pack: package-local recipes + session protocol resolved through `autoresearch workflow-plan`, with mixed provider maturity and some still-bounded HEP-backed steps beneath the workflow layer.",
  "platforms": [
    "claude_code",
    "codex",
    "opencode"
  ],
  "depends_on": {
    "hep-mcp": ">=0.3.0 <0.4.0"
  },
  "source": {
    "repo": "autoresearch-lab/autoresearch-lab",
    "ref": "main",
    "subpath": ".",
    "include": [
      "packages/literature-workflows/recipes/*.json",
      "meta/protocols/session_protocol_v1.md",
      "meta/docs/prompts/prompt-2026-03-24-new-litflow-01-generic-literature-workflow-extraction.md",
      "meta/docs/prompts/prompt-2026-03-24-new-litflow-02-impl-executable-workflow-authority-and-surface-pruning.md"
    ]
  },
  "install": {
    "claude_code": "Consume the checked-in package-local recipes and session protocol through `autoresearch workflow-plan` or direct package-level resolver imports; do not recreate workflow-pack authority inside provider-specific MCP facades, and do not assume every bounded step already has provider-parity beneath the workflow layer.",
    "codex": "Consume the checked-in package-local recipes and session protocol through `autoresearch workflow-plan` or direct package-level resolver imports; keep workflow authority above atomic MCP tools, and treat some bounded steps as still backed by current HEP maturity seams.",
    "opencode": "Consume the checked-in package-local recipes and session protocol through `autoresearch workflow-plan` or direct package-level resolver imports; keep workflow authority in the workflow-pack layer, while recognizing that some bounded steps still depend on current HEP-backed provider maturity."
  }
}
